{"channel_contract_sha256":"f5dc44590c8e9697a00865dc74b721f3088335522e584f8ae96355dc2b5a4216","channel_id":"control.commands","duplicate_count":0,"finished_at":"2026-07-26T12:00:30Z","loss_ratio":0,"lost_count":0,"max_message_age_ms":10,"observation_id":"observation-00000000-0000-4000-8000-000000000001","out_of_order_count":0,"received_count":20,"run_id":"run-00000000-0000-4000-8000-000000000001","schema_version":"zenoh-channel-observation.v1","sent_count":20,"started_at":"2026-07-26T12:00:00Z","status":"passed","violations":[]}
